{
  "$schema": "https://json-schema.org/draft/2020-12/schema",
  "$id": "https://tomestack.local/schemas/character.v3.schema.json",
  "title": "TomeStack character (schemaVersion 3)",
  "description": "Stored character choices, pins and overrides. Derived values are never stored. Unknown properties round-trip. v3 adds classes (levels per class; the sum is the character level) and choices (selections for choice effects). v1 and v2 are read with the new lists empty.",
  "type": "object",
  "required": ["id", "schemaVersion", "name", "rulesFamily", "baseAbilities"],
  "properties": {
    "id": { "$ref": "#/$defs/uuid" },
    "schemaVersion": { "const": 3 },
    "name": { "type": "string", "minLength": 1 },
    "rulesFamily": { "enum": ["srd-5.1", "srd-5.2.1"] },
    "level": { "type": "integer", "minimum": 1, "maximum": 20 },
    "classes": {
      "description": "Levels per class in the order taken; the first is the starting class. Each class reference is an active pin.",
      "type": "array",
      "items": {
        "type": "object",
        "required": ["class", "level"],
        "additionalProperties": false,
        "properties": {
          "class": { "$ref": "#/$defs/contentReference" },
          "level": { "type": "integer", "minimum": 1, "maximum": 20 }
        }
      }
    },
    "choices": {
      "description": "SPEC C-01: selections for choice effects. source is the revision offering the choice; selected pins must be among its options.",
      "type": "array",
      "items": {
        "type": "object",
        "required": ["source", "choiceId", "selected"],
        "additionalProperties": false,
        "properties": {
          "source": { "$ref": "#/$defs/contentReference" },
          "choiceId": { "type": "string", "minLength": 1 },
          "selected": { "type": "array", "items": { "$ref": "#/$defs/contentReference" } }
        }
      }
    },
    "crossFamilyExceptions": {
      "description": "BACKLOG B06: recorded, deliberate use of a pinned revision outside its rules families.",
      "type": "array",
      "items": {
        "type": "object",
        "required": ["content", "reason"],
        "additionalProperties": false,
        "properties": {
          "content": { "$ref": "#/$defs/contentReference" },
          "reason": { "type": "string", "minLength": 1 },
          "recordedAt": { "type": "string", "format": "date-time" }
        }
      }
    },
    "campaignId": { "$ref": "#/$defs/uuid" },
    "baseAbilities": {
      "type": "object",
      "required": ["str", "dex", "con", "int", "wis", "cha"],
      "additionalProperties": false,
      "properties": {
        "str": { "$ref": "#/$defs/score" },
        "dex": { "$ref": "#/$defs/score" },
        "con": { "$ref": "#/$defs/score" },
        "int": { "$ref": "#/$defs/score" },
        "wis": { "$ref": "#/$defs/score" },
        "cha": { "$ref": "#/$defs/score" }
      }
    },
    "pins": { "type": "array", "items": { "$ref": "#/$defs/contentReference" } },
    "overrides": {
      "type": "array",
      "items": {
        "type": "object",
        "required": ["field", "value"],
        "additionalProperties": false,
        "properties": {
          "field": { "type": "string", "minLength": 1 },
          "value": { "type": "integer" },
          "reason": { "type": "string" }
        }
      }
    },
    "updatedAt": { "type": "string", "format": "date-time" }
  },
  "$defs": {
    "uuid": { "type": "string", "pattern": "^[0-9a-f]{8}-[0-9a-f]{4}-[0-9a-f]{4}-[0-9a-f]{4}-[0-9a-f]{12}$" },
    "score": { "type": "integer", "minimum": 1, "maximum": 30 },
    "contentReference": {
      "type": "object",
      "required": ["contentId", "revisionId"],
      "additionalProperties": false,
      "properties": {
        "contentId": { "$ref": "#/$defs/uuid" },
        "revisionId": { "$ref": "#/$defs/uuid" }
      }
    }
  }
}
