{
  "id": "5f1dca00-0000-4000-8000-000000b51101",
  "schemaVersion": 3,
  "name": "Rurik Aldermoor",
  "rulesFamily": "srd-5.1",
  "level": 1,
  "classes": [
    {
      "class": {
        "contentId": "51c00000-0000-4000-8000-000000000003",
        "revisionId": "51e00000-0000-4000-8000-000000409003"
      },
      "level": 1
    }
  ],
  "choices": [
    {
      "source": {
        "contentId": "51c00000-0000-4000-8000-000000000003",
        "revisionId": "51e00000-0000-4000-8000-000000409003"
      },
      "choiceId": "barbarian-skills",
      "selected": [
        {
          "contentId": "51c00000-0000-4000-8000-000000000008",
          "revisionId": "51e00000-0000-4000-8000-000000000008"
        },
        {
          "contentId": "51c00000-0000-4000-8000-000000000009",
          "revisionId": "51e00000-0000-4000-8000-000000000009"
        }
      ]
    }
  ],
  "baseAbilities": {
    "str": 16,
    "dex": 14,
    "con": 16,
    "int": 8,
    "wis": 10,
    "cha": 10
  },
  "pins": [
    {
      "contentId": "51c00000-0000-4000-8000-000000000001",
      "revisionId": "51e00000-0000-4000-8000-000000000001"
    },
    {
      "contentId": "51c00000-0000-4000-8000-000000000002",
      "revisionId": "51e00000-0000-4000-8000-000000000002"
    }
  ],
  "overrides": [],
  "crossFamilyExceptions": [],
  "updatedAt": "2026-10-27T00:00:00+00:00"
}
