{
  "id": "5f1dca00-0000-4000-8000-000000b52114",
  "schemaVersion": 3,
  "name": "Hesper Dunmore",
  "rulesFamily": "srd-5.2.1",
  "level": 20,
  "classes": [
    {
      "class": {
        "contentId": "52c00000-0000-4000-8000-000000000011",
        "revisionId": "52e00000-0000-4000-8000-000000409011"
      },
      "level": 20
    }
  ],
  "choices": [
    {
      "source": {
        "contentId": "52c00000-0000-4000-8000-000000000002",
        "revisionId": "52e00000-0000-4000-8000-000000000002"
      },
      "choiceId": "soldier-ability-scores",
      "selected": [
        {
          "contentId": "52c00000-0000-4000-8000-000000000004",
          "revisionId": "52e00000-0000-4000-8000-000000000004"
        }
      ]
    },
    {
      "source": {
        "contentId": "52c00000-0000-4000-8000-000000000011",
        "revisionId": "52e00000-0000-4000-8000-000000409011"
      },
      "choiceId": "barbarian-skills",
      "selected": [
        {
          "contentId": "52c00000-0000-4000-8000-000000000017",
          "revisionId": "52e00000-0000-4000-8000-000000000017"
        },
        {
          "contentId": "52c00000-0000-4000-8000-000000000018",
          "revisionId": "52e00000-0000-4000-8000-000000000018"
        }
      ]
    },
    {
      "source": {
        "contentId": "52c00000-0000-4000-8000-000000000011",
        "revisionId": "52e00000-0000-4000-8000-000000409011"
      },
      "choiceId": "barbarian-subclass",
      "selected": [
        {
          "contentId": "52c00000-0000-4000-8000-000000000023",
          "revisionId": "52e00000-0000-4000-8000-000000409023"
        }
      ]
    },
    {
      "source": {
        "contentId": "52c00000-0000-4000-8000-000000000025",
        "revisionId": "52e00000-0000-4000-8000-000000000025"
      },
      "choiceId": "primal-knowledge-skill",
      "selected": [
        {
          "contentId": "52c00000-0000-4000-8000-000000000019",
          "revisionId": "52e00000-0000-4000-8000-000000000019"
        }
      ]
    }
  ],
  "baseAbilities": {
    "str": 16,
    "dex": 14,
    "con": 16,
    "int": 8,
    "wis": 10,
    "cha": 10
  },
  "pins": [
    {
      "contentId": "52c00000-0000-4000-8000-000000000001",
      "revisionId": "52e00000-0000-4000-8000-000000000001"
    },
    {
      "contentId": "52c00000-0000-4000-8000-000000000002",
      "revisionId": "52e00000-0000-4000-8000-000000000002"
    }
  ],
  "overrides": [],
  "crossFamilyExceptions": [],
  "updatedAt": "2026-10-27T00:00:00+00:00"
}
