{
  "id": "5f1dca00-0000-4000-8000-00000000a051",
  "schemaVersion": 3,
  "name": "Korga (M1 acceptance, SRD 5.1)",
  "rulesFamily": "srd-5.1",
  "level": 3,
  "classes": [
    { "class": { "contentId": "51c00000-0000-4000-8000-000000000003", "revisionId": "51e00000-0000-4000-8000-000000000003" }, "level": 3 }
  ],
  "choices": [
    {
      "source": { "contentId": "51c00000-0000-4000-8000-000000000003", "revisionId": "51e00000-0000-4000-8000-000000000003" },
      "choiceId": "barbarian-skills",
      "selected": [
        { "contentId": "51c00000-0000-4000-8000-000000000009", "revisionId": "51e00000-0000-4000-8000-000000000009" },
        { "contentId": "51c00000-0000-4000-8000-000000000012", "revisionId": "51e00000-0000-4000-8000-000000000012" }
      ]
    },
    {
      "source": { "contentId": "51c00000-0000-4000-8000-000000000003", "revisionId": "51e00000-0000-4000-8000-000000000003" },
      "choiceId": "primal-path",
      "selected": [
        { "contentId": "51c00000-0000-4000-8000-000000000014", "revisionId": "51e00000-0000-4000-8000-000000000014" }
      ]
    }
  ],
  "baseAbilities": { "str": 15, "dex": 13, "con": 14, "int": 8, "wis": 12, "cha": 10 },
  "pins": [
    { "contentId": "51c00000-0000-4000-8000-000000000001", "revisionId": "51e00000-0000-4000-8000-000000000001" },
    { "contentId": "51c00000-0000-4000-8000-000000000002", "revisionId": "51e00000-0000-4000-8000-000000000002" }
  ],
  "overrides": [
    { "field": "hitPoints", "value": 33, "reason": "Rolled 8 and 7 at levels 2 and 3" }
  ],
  "crossFamilyExceptions": [],
  "updatedAt": "2026-09-26T00:00:00+00:00"
}
