{
  "id": "5f1dca00-0000-4000-8000-000000b51305",
  "schemaVersion": 3,
  "name": "Orlin Pebblebrook",
  "rulesFamily": "srd-5.1",
  "level": 5,
  "classes": [
    {
      "class": {
        "contentId": "51c00000-0000-4000-8000-000000420001",
        "revisionId": "51e00000-0000-4000-8000-000000420001"
      },
      "level": 5
    }
  ],
  "choices": [
    {
      "source": {
        "contentId": "51c00000-0000-4000-8000-000000420001",
        "revisionId": "51e00000-0000-4000-8000-000000420001"
      },
      "choiceId": "monk-skills",
      "selected": [
        {
          "contentId": "51c00000-0000-4000-8000-000000420801",
          "revisionId": "51e00000-0000-4000-8000-000000420801"
        },
        {
          "contentId": "51c00000-0000-4000-8000-000000420806",
          "revisionId": "51e00000-0000-4000-8000-000000420806"
        }
      ]
    },
    {
      "source": {
        "contentId": "51c00000-0000-4000-8000-000000420001",
        "revisionId": "51e00000-0000-4000-8000-000000420001"
      },
      "choiceId": "monastic-tradition",
      "selected": [
        {
          "contentId": "51c00000-0000-4000-8000-000000420002",
          "revisionId": "51e00000-0000-4000-8000-000000420002"
        }
      ]
    }
  ],
  "baseAbilities": {
    "str": 10,
    "dex": 16,
    "con": 14,
    "int": 10,
    "wis": 14,
    "cha": 8
  },
  "pins": [
    {
      "contentId": "51c00000-0000-4000-8000-000000000001",
      "revisionId": "51e00000-0000-4000-8000-000000000001"
    },
    {
      "contentId": "51c00000-0000-4000-8000-000000000002",
      "revisionId": "51e00000-0000-4000-8000-000000000002"
    }
  ],
  "overrides": [],
  "crossFamilyExceptions": [],
  "updatedAt": "2026-10-27T00:00:00+00:00"
}
