{
  "id": "5f1dca00-0000-4000-8000-000000b52303",
  "schemaVersion": 3,
  "name": "Kesra Dunmoor",
  "rulesFamily": "srd-5.2.1",
  "level": 3,
  "classes": [
    {
      "class": {
        "contentId": "52c00000-0000-4000-8000-000000420001",
        "revisionId": "52e00000-0000-4000-8000-000000420001"
      },
      "level": 3
    }
  ],
  "choices": [
    {
      "source": {
        "contentId": "52c00000-0000-4000-8000-000000000002",
        "revisionId": "52e00000-0000-4000-8000-000000000002"
      },
      "choiceId": "soldier-ability-scores",
      "selected": [
        {
          "contentId": "52c00000-0000-4000-8000-000000000004",
          "revisionId": "52e00000-0000-4000-8000-000000000004"
        }
      ]
    },
    {
      "source": {
        "contentId": "52c00000-0000-4000-8000-000000420001",
        "revisionId": "52e00000-0000-4000-8000-000000420001"
      },
      "choiceId": "monk-skills",
      "selected": [
        {
          "contentId": "52c00000-0000-4000-8000-000000420801",
          "revisionId": "52e00000-0000-4000-8000-000000420801"
        },
        {
          "contentId": "52c00000-0000-4000-8000-000000420806",
          "revisionId": "52e00000-0000-4000-8000-000000420806"
        }
      ]
    },
    {
      "source": {
        "contentId": "52c00000-0000-4000-8000-000000420001",
        "revisionId": "52e00000-0000-4000-8000-000000420001"
      },
      "choiceId": "monk-subclass",
      "selected": [
        {
          "contentId": "52c00000-0000-4000-8000-000000420002",
          "revisionId": "52e00000-0000-4000-8000-000000420002"
        }
      ]
    }
  ],
  "baseAbilities": {
    "str": 10,
    "dex": 16,
    "con": 14,
    "int": 10,
    "wis": 14,
    "cha": 8
  },
  "pins": [
    {
      "contentId": "52c00000-0000-4000-8000-000000000001",
      "revisionId": "52e00000-0000-4000-8000-000000000001"
    },
    {
      "contentId": "52c00000-0000-4000-8000-000000000002",
      "revisionId": "52e00000-0000-4000-8000-000000000002"
    }
  ],
  "overrides": [],
  "crossFamilyExceptions": [],
  "updatedAt": "2026-10-27T00:00:00+00:00"
}
