{
  "id": "5f1dca00-0000-4000-8000-000000b51201",
  "schemaVersion": 3,
  "name": "Nessa Brindlewood",
  "rulesFamily": "srd-5.1",
  "level": 1,
  "classes": [
    {
      "class": {
        "contentId": "51c00000-0000-4000-8000-000000410001",
        "revisionId": "51e00000-0000-4000-8000-000000410001"
      },
      "level": 1
    }
  ],
  "choices": [
    {
      "source": {
        "contentId": "51c00000-0000-4000-8000-000000410001",
        "revisionId": "51e00000-0000-4000-8000-000000410001"
      },
      "choiceId": "rogue-skills",
      "selected": [
        {
          "contentId": "51c00000-0000-4000-8000-000000410801",
          "revisionId": "51e00000-0000-4000-8000-000000410801"
        },
        {
          "contentId": "51c00000-0000-4000-8000-000000410803",
          "revisionId": "51e00000-0000-4000-8000-000000410803"
        },
        {
          "contentId": "51c00000-0000-4000-8000-000000410807",
          "revisionId": "51e00000-0000-4000-8000-000000410807"
        },
        {
          "contentId": "51c00000-0000-4000-8000-000000410811",
          "revisionId": "51e00000-0000-4000-8000-000000410811"
        }
      ]
    },
    {
      "source": {
        "contentId": "51c00000-0000-4000-8000-000000410001",
        "revisionId": "51e00000-0000-4000-8000-000000410001"
      },
      "choiceId": "rogue-expertise",
      "selected": [
        {
          "contentId": "51c00000-0000-4000-8000-000000410832",
          "revisionId": "51e00000-0000-4000-8000-000000410832"
        },
        {
          "contentId": "51c00000-0000-4000-8000-000000410837",
          "revisionId": "51e00000-0000-4000-8000-000000410837"
        }
      ]
    }
  ],
  "baseAbilities": {
    "str": 10,
    "dex": 16,
    "con": 14,
    "int": 12,
    "wis": 12,
    "cha": 8
  },
  "pins": [
    {
      "contentId": "51c00000-0000-4000-8000-000000000001",
      "revisionId": "51e00000-0000-4000-8000-000000000001"
    },
    {
      "contentId": "51c00000-0000-4000-8000-000000000002",
      "revisionId": "51e00000-0000-4000-8000-000000000002"
    }
  ],
  "overrides": [],
  "crossFamilyExceptions": [],
  "updatedAt": "2026-10-27T00:00:00+00:00"
}
