{
  "id": "5f1dca00-0000-4000-8000-000000b5220b",
  "schemaVersion": 3,
  "name": "Marek Ollenfold",
  "rulesFamily": "srd-5.2.1",
  "level": 11,
  "classes": [
    {
      "class": {
        "contentId": "52c00000-0000-4000-8000-000000410001",
        "revisionId": "52e00000-0000-4000-8000-000000410001"
      },
      "level": 11
    }
  ],
  "choices": [
    {
      "source": {
        "contentId": "52c00000-0000-4000-8000-000000000002",
        "revisionId": "52e00000-0000-4000-8000-000000000002"
      },
      "choiceId": "soldier-ability-scores",
      "selected": [
        {
          "contentId": "52c00000-0000-4000-8000-000000000004",
          "revisionId": "52e00000-0000-4000-8000-000000000004"
        }
      ]
    },
    {
      "source": {
        "contentId": "52c00000-0000-4000-8000-000000410001",
        "revisionId": "52e00000-0000-4000-8000-000000410001"
      },
      "choiceId": "rogue-skills",
      "selected": [
        {
          "contentId": "52c00000-0000-4000-8000-000000410801",
          "revisionId": "52e00000-0000-4000-8000-000000410801"
        },
        {
          "contentId": "52c00000-0000-4000-8000-000000410803",
          "revisionId": "52e00000-0000-4000-8000-000000410803"
        },
        {
          "contentId": "52c00000-0000-4000-8000-000000410807",
          "revisionId": "52e00000-0000-4000-8000-000000410807"
        },
        {
          "contentId": "52c00000-0000-4000-8000-000000410810",
          "revisionId": "52e00000-0000-4000-8000-000000410810"
        }
      ]
    },
    {
      "source": {
        "contentId": "52c00000-0000-4000-8000-000000410001",
        "revisionId": "52e00000-0000-4000-8000-000000410001"
      },
      "choiceId": "rogue-expertise",
      "selected": [
        {
          "contentId": "52c00000-0000-4000-8000-000000410832",
          "revisionId": "52e00000-0000-4000-8000-000000410832"
        },
        {
          "contentId": "52c00000-0000-4000-8000-000000410837",
          "revisionId": "52e00000-0000-4000-8000-000000410837"
        }
      ]
    },
    {
      "source": {
        "contentId": "52c00000-0000-4000-8000-000000410001",
        "revisionId": "52e00000-0000-4000-8000-000000410001"
      },
      "choiceId": "rogue-subclass",
      "selected": [
        {
          "contentId": "52c00000-0000-4000-8000-000000410002",
          "revisionId": "52e00000-0000-4000-8000-000000410002"
        }
      ]
    },
    {
      "source": {
        "contentId": "52c00000-0000-4000-8000-000000410001",
        "revisionId": "52e00000-0000-4000-8000-000000410001"
      },
      "choiceId": "rogue-expertise-6",
      "selected": [
        {
          "contentId": "52c00000-0000-4000-8000-000000410821",
          "revisionId": "52e00000-0000-4000-8000-000000410821"
        },
        {
          "contentId": "52c00000-0000-4000-8000-000000410825",
          "revisionId": "52e00000-0000-4000-8000-000000410825"
        }
      ]
    }
  ],
  "baseAbilities": {
    "str": 10,
    "dex": 16,
    "con": 14,
    "int": 12,
    "wis": 12,
    "cha": 8
  },
  "pins": [
    {
      "contentId": "52c00000-0000-4000-8000-000000000001",
      "revisionId": "52e00000-0000-4000-8000-000000000001"
    },
    {
      "contentId": "52c00000-0000-4000-8000-000000000002",
      "revisionId": "52e00000-0000-4000-8000-000000000002"
    }
  ],
  "overrides": [],
  "crossFamilyExceptions": [],
  "updatedAt": "2026-10-27T00:00:00+00:00"
}
